"RT @CNBCPro: As states reopen, these retail stocks will benefit most, JPMorgan says https://t.co/5DfJeYMYs0",1255113459395710976,
"New for subscribers:  As states reopen, these retail stocks will benefit most, JPMorgan says https://t.co/wYk7OIi6x4 Check out @CNBCPro for a free trial.",1254843948654301185,
"Stocks making the biggest moves midday: Las Vegas Sands, Twitter, JPMorgan Chase, Beyond Meat &amp; more https://t.co/ZCRci76RoN",1254807156383256576,
JPMorgan tells small business customers to apply with other banks on fear that funds will run out https://t.co/NRB6dwIwna,1253396738926395392,
"RT @YunLi626: JPMorgan's Marko Kolanovic: ""Sunshine – an important factor in reducing COVID-19 spread.""

He cited a study linking the virus…",1252635056784519169,
"New for subscribers:  JPMorgan's Kolanovic, who called market turn, says investors should bet on sunshine killing virus https://t.co/Io3BQ8X42B Check out @CNBCPro for a free trial.",1252631582340497409,
"For subscribers: Buy these 'sustainable dividend' stocks for return in these uncertain times, JPMorgan says https://t.co/tsbz26d379 Check out @CNBCPro for a free trial.",1252427850595987456,
"New for subscribers:  Buy these 'sustainable dividend' stocks for return in these uncertain times, JPMorgan says https://t.co/UognELMgev Check out @CNBCPro for a free trial.",1251893105596534784,
"Notable Insider Buys Of The Past Week: JPMorgan, Huntington Ingalls And More https://t.co/ok4N0A8ld6 $GME $HII $JPM",1251977654368165888,
"RT @Tanzeel_Akhtar: JPMorgan Posts Q1 Sales Beat, Earnings Miss, Builds Credit Reserve For Recession $JPM https://t.co/L1s24lYiYe via @benz…",1250054541753671684,
"JPMorgan Will Only Accept Small Business Loans Under Federal Scheme, Suspends All Others $BAC $JPM $WFC https://t.co/kMh98MJAWQ",1248253079553703937,
"JPMorgan CEO Jamie Dimon In Recovery After Heart Surgery, Bank's Co-Presidents Temporarily In Charge $JPM https://t.co/bLNb21dmc2",1235778277425451008,
"JPMorgan Set To Cut 1% Of All Jobs In Consumer Unit: Report
$JPM

https://t.co/dWaqel1shr",1222363283744751616,
"JPMorgan Downgrades Beyond Meat On Valuation $BYND
https://t.co/CeBlmEAKbD",1222228584120668161,
9 Takeaways From The JPMorgan Healthcare Conference $IBB $XBI https://t.co/8OWQH0hEK5,1219062744361717760,
"The Week Ahead In Biotech: JPMorgan Healthcare Conference, FDA Panel Reviews Opioid Pain Drugs, I-Mab's IPO $IBB $XBI https://t.co/qKdmeSqnie",1216492311242252293,
Here's How Much Investing $100 In JPMorgan Stock Back In 2010 Would Be Worth Today $JPM https://t.co/qBna8peHTF,1216092254298869761,
"JPMorgan Projects That Netflix Global Paid Subscribers Will Nearly Double By 2024, Driven By International Growth $NFLX https://t.co/5aXokd5dcS",1214596306842218496,
Option Traders Buying JPMorgan Puts Ahead Of November Jobs Report $JPM https://t.co/Y7SY6VaAT2,1201640940525494274,
"Option Traders Buying JPMorgan Puts Ahead Of November Jobs Report $JPM 
https://t.co/xhQtPCUNFF",1201589596238290945,
RT @Zachary: JPMorgan Chase says it has sent $9.3 billion to small businesses under the Paycheck Protection Program. The bank says that's m…,1250054303881949184,
"JPMorgan Says Slowing U.S. Virus Cases to Put Floor Under Stocks

$JPM $XLF 

https://t.co/dXLgWzHa1k",1247129194108276736,
"Anatomy of an Outbreak: How Coronavirus Swept Through JPMorgan’s Trading Floor

https://t.co/LD4gL5Cenz",1246182410321973248,
RT @carlquintanilla: JPMORGAN: Our models for New York state indicate “nearly an order of magnitude (~5-10 times) lower projected peak hosp…,1248277840862359552,
"JPMorgan, Bank of America, Wells Fargo and Citigroup attracted a huge amount of deposits in the first quarter during the coronavirus pandemic https://t.co/ADHfqcSpMz",1253281726891282432,
Executives at firms like Goldman Sachs and JPMorgan had to balance the opportunity for trading profits with the safety of staff https://t.co/Y3nmnOcUAS,1250503681151315978,
JPMorgan Chase and Wells Fargo have set aside billions of dollars to cope with the coronavirus fallout. That may be far from enough. https://t.co/mj0qkfE0S8,1250137519091519489,
"JPMorgan Chase reported earnings, making it the first major U.S. bank to show how the spreading coronavirus has affected its lending activity https://t.co/4EkQ3aPP6l",1250019945276211201,
JPMorgan CEO Writes in Shareholder Letter: Expecting ‘a Bad Recession’ https://t.co/Xli9jXZdz8,1247169729393033216,
Outbreak: How coronavirus swept through JPMorgan’s trading floor https://t.co/Gs9igG8sA1,1246456506737995776,
Outbreak: How coronavirus swept through JPMorgan’s trading floor  https://t.co/duMydNH3qy,1246190502371897349,
"JPMorgan Chase Chief Executive James Dimon returned to work this week, a month after undergoing emergency heart surgery https://t.co/63A0EOt9j1",1245779806710632450,
"“Oil is caught in the midst of a severe demand and supply shock, both of which have an uncertain future,” JPMorgan Chase analysts said https://t.co/grm7ndmdpD",1239564617304748032,
JPMorgan’s James Dimon is recovering at home after heart surgery https://t.co/GddivO06cj,1238180080679112711,
"Daniel Pinto and Gordon Smith, co-presidents of JPMorgan Chase, are in charge at America’s largest bank as CEO Dimon recovers after heart surgery https://t.co/sHKBFSPk5U",1236032561023012864,
Investigators are comparing disclosures Mr. Staley made to Barclays with documents handed over by JPMorgan https://t.co/A2pMy3PQdi,1235901729637531648,
JPMorgan CEO Jamie Dimon is recovering after emergency heart surgery https://t.co/o7jPlCe6T5,1235753766714040321,
"Mr. Staley told journalists Thursday that his contact with Mr. Epstein went back to 2000, when he led JPMorgan’s private bank and the financier was a client https://t.co/yvIKyElD79",1228003415176802304,
The Federal Home Loan Banks were founded during the Depression to support housing finance. They have become a supplier of cheap funding to the likes of Wells Fargo and JPMorgan Chase. https://t.co/PoEtgzRzRG,1224675233812156418,
Shareholders usually love buybacks. But JPMorgan has “a high-class problem.” Its stock is doing so well that buybacks might no longer make sense. https://t.co/vJpdVXKmci,1224312859737427974,
Going to the store? No need to take your card or phone if Amazon has its way. The tech giant is working with the likes of Visa and JPMorgan to let consumers pay with wave of a hand https://t.co/ynKaNjoceb,1218919554216316930,
"JPMorgan Chase and Citigroup reported big fourth-quarter earnings, but Wells Fargo was hit by a legal charge. https://t.co/sZq4O3yrFz",1217281469661556737,
JPMorgan Chase revamps entry-level tech program in race for talent https://t.co/ni85KwJoMT,1027706081684975616,
"Some of the nation’s biggest banks, including JPMorgan Chase, Citibank and U.S. Bank, prioritized the applications of their wealthiest clients before turning to other loan seekers, according to half a dozen bank employees and financial industry executives. https://t.co/1QbGFLRgLf",1253332557761900552,
"Lawsuits accuse Bank of America, JPMorgan Chase and Wells Fargo of processing stimulus loans for larger customers first, before money ran out https://t.co/LnB6tUFFhJ",1252366195312824324,
First-quarter earnings reports from JPMorgan Chase and Wells Fargo showed the country’s largest banks were preparing for customer pain https://t.co/rmKVYA6wMx,1250349906109198337,
JPMorgan Chase and Wells Fargo — which on Tuesday were the first two major banks to report earnings this quarter — set aside billions of dollars each for losses on loans to customers who may soon no longer have the means to repay them. https://t.co/KqsUTflySG,1250258563018166272,
First-quarter earnings reports from JPMorgan Chase and Wells Fargo showed the country’s largest banks were preparing for customer pain https://t.co/4Z8mSNpurv,1250197677058523141,
First-quarter earnings reports from JPMorgan Chase and Wells Fargo showed the country’s largest banks were preparing for customer pain https://t.co/KfBQNot9ml,1250161923087372289,
JPMorgan Chase is increasing its efforts to diversify its work force and customer base after a Dec. 11 @nytimes report showed a black customer and a black employee each struggling to access the same opportunities as their white peers https://t.co/8466gLzjgu,1245094026262597634,
"As buying back their own shares is both politically and economically untenable, AT&amp;T, Nordstrom and McDonald’s are among the companies that have recently suspended buyback programs, as have big banks such as JPMorgan Chase and Citigroup. https://t.co/36r9nJy4mg",1242677853575090176,
"The Housing Policy Council, a trade group that includes Citigroup, Wells Fargo, JPMorgan Chase and Quicken Loans, wants a plan in place by April 1 https://t.co/BjKCaao9NF",1240103174826057728,
"Dow Jones hits record high: JPMorgan, RH, Insulet in buy zones from bullish rebounds $JPM $RH $PODD https://t.co/ZhZb7LcPZE",1217189606833000450,
"Stocks hold gains; Lululemon tests buy point, hot IPO jumps, JPMorgan earnings due $LULU $INMD $JPM Sponsored by Interactive Brokers. @IBKR https://t.co/1LBIxPDa3I",1183834788303499264,
"Netflix, JPMorgan, Goldman, IBM, J&amp;J To Report: Investing Action Plan https://t.co/GYvVH7OoBj",1182717256775528448,
"S&amp;P 500 undercuts 50-Day on weak factory data; TD Ameritrade, Proofpoint, JPMorgan $AMTD $PFPT $JPM Sponsored by Interactive Brokers @ibkr https://t.co/sAQBy0lsYl",1179123661317361666,
"Stocks sell off on impeachment risk; JPMorgan, Carvana, Burlington Stores in focus $JPM $CVNA $BURL Sponsored by Interactive Brokers @ibkr https://t.co/01vtIOPuFZ",1176587016793780224,
RT @MarketSmith: JPMorgan Thinks Its New Robot Can Save You A Bundle https://t.co/DgpSzLIPME,1148961849506877441,
"RT @IBD_ECarson: Apple, JPMorgan Lead 5 Dow Stocks Moving Late On News https://t.co/5yhJjqtnFc $aapl $ba $nke $jpm $gs https://t.co/jkD8mbn…",1144443459882893312,
"RT @danacimilluca: In case you wondered who's the head of M&amp;A at JPMorgan, it's ... Jamie Dimon https://t.co/bzf0RFazjP cc @lizrhoffman htt…",1028011597338497025,
"RT @telisdemos: Prosper joins the Billion Dollar Club w/ funding from Credit Suisse and JPMorgan at $1.9bn value, @WSJ reports http://t.co/…",585947924615532544,
